Name,Site,Logo Urls,Category,Location,Code,Demo,Technical Whitepaper,Professional Inv.,Inv. ($MM),ICO,ICO ($MM),Funding Method,Platform,Coin Symbol,Twitter Handle,Description,Notables,Dead
Simply Vital Health,https://www.simplyvitalhealth.com/,https://icoholder.com/files/img/c969ab61b34f832a806882646f841e81.jpeg,Interoperability,"Bloomfield, Connecticut, USA",https://github.com/Health-Nexus,,https://docsend.com/view/cuufmc5,Yes,0.5,Yes,,"SEED,ICO",Ethereum,HLTH,@SimplyVitalHQ,"Health Nexus is an open-source blockchain protocol for handling data transfer, payments and storage specifically designed for healthcare",,
SmartHealthcare,https://smarthealthcare.today/,https://assets.coingecko.com/coins/images/2319/large/shc.png?1515500205,Interoperability,Estonia,https://github.com/smarthealthcaretoday/,,https://smarthealthcare.today/resources/whitepaper.pdf,,,Yes,,ICO,Ethereum,SHC,@SmrtHealthToday,System to integrate and process health related data collected from different data sources.,,
Solve.Care,https://solve.care/,https://i2.wp.com/bitcoinexchangeguide.com/wp-content/uploads/2017/12/solve-care.jpg?resize=696%2C449&ssl=1,"Payments, Claims and Other Services",Estonia,https://github.com/SolveCare,,https://solve.care/solvecare-documents?l=en,,,Yes,23.6,ICO,Ethereum,CAN,@Solve_Care,Blockchain platform for decentralized administration and payments of healthcare.,,
Spiritus,https://www.spirituspartners.com,https://static1.squarespace.com/static/5a708340c027d82f766de3bd/t/5a708f1bc83025e26582668c/1523267191078/?format=1500w,Supply Chain,"Edinburgh, United Kingdom",,,,,,,,,,,@SpiritusPtrs,Solution to allow all involved parties to record evidence of service for critical assets and infrastructure.,,
SSOT Health Blockchain,https://www.ssothealth.org,"https://static.wixstatic.com/media/4b78ba_27700438c9724311abc1544cd684151b~mv2.png/v1/fill/w_72,h_84,al_c,usm_0.66_1.00_0.01/4b78ba_27700438c9724311abc1544cd684151b~mv2.png",Patient Data Management,"Cambridge, Massachusetts, USA",,,,,,Yes,,ICO,Ethereum,SEHR,@ssothealth,Medical records system to enable patients to own and control their medical history data,,
Synthium Health,https://tge.synthiumhealth.com/,https://foxico.io/static/uploads/logofile-1511391119916.png,Supply Chain,"Marietta, Georgia, USA",,,,Yes,0.5,Yes,0.5,"SEED,ICO",Ethereum,SHP,@SynthiumHealth,Supply-chain management platform that allows healthcare suppliers and buyers to conduct business.,,
Tides,https://pbs.twimg.com/profile_images/971805158337232896/WSHC9N8X_400x400.jpg,https://pbs.twimg.com/profile_images/971805158337232896/WSHC9N8X_400x400.jpg,"Payments, Claims and Other Services","San Francisco, CA, USA",,,https://docsend.com/view/nw2ks4n,,,,,,Stellar,TIDE,@TidesNetwork,Decentralized health insurance network.,,
Timicoin,https://timicoin.io,https://timicoin.io/images/logo.svg,Patient Data Management,Not Supplied,,,,,,,,,,,@timicoin,Health information exchange that will secure health information and deliver patient records only with patient authorization.,,
trustedhealth,https://trustedhealth.io/,https://ibcgroup.io/wp-content/uploads/2017/12/trustedhealth-big.png,Digital Medicine,United Kingdom,,,,,,Yes,,ICO,Ethereum,TDH,@_trustedhealth,Platform to connect patients and doctors of rare or life-threatening diseases.,,
Universal Health Coin,https://www.universalhealthcoin.com/,https://i0.wp.com/blockchainhealthcarereview.com/wp-content/uploads/2017/12/Universal-Health-Coin.png?resize=228%2C251&ssl=1,"Payments, Claims and Other Services","Augusta, Georgia, USA",,,http://www.universalhealthcoin.com/wp-content/uploads/UHCWhitePaper-V2.3.pdf,,,Yes,,ICO,NEO,UHC,@UHCToken,"A privacy focused,, token-based healthcare finance system that utilizes blockchain to arbitrage, decentralize and provision payment of health services.",,
Veris Foundation,https://www.verisfoundation.com/,https://i.vimeocdn.com/video/655062420_640.jpg,"Payments, Claims and Other Services","Jersey City, New Jersey, USA",https://github.com/VerisFoundation,,https://veris.docsend.com/view/fbqysxf,,,Yes,,ICO,NEO,VRS,@verisfoundation,The Veris platform is a blockchain that specifically addresses the expenses in the American healthcare system. The platform is open source and takes advantage of smart contracts to replace portions of the eligibility through remittance process in the provisioning of healthcare services.,,
WELL,https://joinwell.io/,https://www.coinstaker.com/wp-content/uploads/2018/01/Well_logo_H_Teal_CMYK.jpg,Digital Medicine,"Santa Monica, California, USA",,,,,,Yes,3,ICO,Ethereum,WELL,@jointeamwell,"Mobile healthcare marketplace for telehealth, clinics, personalized service, and health data storage.",,
Youbase,https://www.youbase.io,https://ccn2017.wpengine.com/wp-content/uploads/2015/06/1-youbase.png,Patient Data Management,"Englewood, CO, USA",https://github.com/YouBase,https://developer.youbase.io,https://paper.youbase.io/content/,Yes,1,,,SEED,,,@youbaseio,Enables patients to create and maintain a personal data store on a distributed public network,,
Zenome,https://zenome.io/,https://i.imgur.com/NjyUZs3.png,Marketplace,"Moscow, Russia",https://github.com/zenome,,https://zenome.io/download/whitepaper.pdf,,,Yes,0.6,ICO,Ethereum,ZNA,@ZenomePlatform,A marketplace for genomic data and services,,